{
  "version": 1,
  "type": "grouped-bar",
  "title": "JSON parse benchmark",
  "subtitle": "main vs branch",
  "unit": "ops/sec",
  "labels": ["run-1", "run-2", "run-3"],
  "series": [
    {
      "name": "main",
      "values": [1200, 1180, 1215],
      "color": "#5B8E7D"
    },
    {
      "name": "branch",
      "values": [1350, 1340, 1362],
      "color": "#F4A259"
    }
  ]
}
