{
  "version": 1,
  "type": "line",
  "title": "Benchmark history",
  "subtitle": "ops/sec over recent CI runs",
  "unit": "ops/sec",
  "labels": ["run-101", "run-102", "run-103", "run-104", "run-105"],
  "series": [
    {
      "name": "main",
      "values": [1200, 1214, 1221, 1232, 1240],
      "color": "#5B8E7D"
    },
    {
      "name": "branch",
      "values": [1260, 1288, 1290, 1302, 1315],
      "color": "#BC4B51"
    }
  ]
}
